,Task_name,Task_description,Task_label,Task_priority,Sprint_number,Planned_estimate,Actual_estimate,Optimistic,Most_likely,Pessimistic,Weighted_average,Standard_deviation,Risk_factor,Standard_confidence,High_confidence,Higher_confidence,Highest_confidence,Final_estimate,Variance,Ai_estimate
0,[New Containers] Remove input/process dotted line separation in flows and add background color for source,Right now the flow container has a dashed line that separates the INPUT from the PROCESS part of the flow. The dashed line should be removed in favor of just changing the background color of the INPUT section.    Pending mockups.,EST_BE,Medium,INT Sprint 1,16,16,15,16,16,15.83,0.17,0.01,15.83,15.92,16.05,16.23,15,6561,8
1,Studio support for new OAuth configuration,"As a Studio user, I will like to have support for the new OAuth configuration.  Studio editors should support generating the improved user experience XML.",EST_BE,Medium,INT Sprint 1,4,5,3,4,4,3.83,0.17,0.04,3.83,3.92,4.05,4.23,3,441,8
2,"migrate items from 562 get error dialog popup, and ""Pattern Frequency"" indicator still show old name in analysis.","1. start 562 tac, on configuration page select  mysql  database,  create two svn projects in (Project type: DataQuality)  in two projects create items like file attached(attached zip file is a remote project)  2. stop 562 tac.  3. start 621 tac, on the configuration page select the database used in 562, then it will inform need to migration, do migration.  4. logon the 621 tac, will show the project has created on 562.  5. start 621 studio, make sure it is a new workspace,  logon the remote project. then first perspective is DI, then change to DQ, get error dialog pop up.  6. check the analysis ""column_java_in_first"" and ""column_sql_in_first"", the ""Pattern Frequency"" ,""Pattern Low Frequency"" and ""Date Pattern Frequency"" indicators still show old name.  7. exit studio, then logon another project, during the start up also get error dialog popup.",EST_BE,Medium,INT Sprint 1,4,4,3,4,5,4.0,0.33,0.08,4.0,4.17,4.42,4.77,4,729,8
3,Allow extensions code to be splitted in several units,"As described in the execution section of the spec, a extension's developer needs to have the option to spread the configurations and operations across several classes which instances have their own lifecycle.",EST_BE,Medium,INT Sprint 1,16,16,15,16,16,15.83,0.17,0.01,15.83,15.92,16.05,16.23,15,6561,8
4,HdfsMongoDB Job failing due because of missing ID in Default Tuple,"Looks to have been introduced by https://github.com/spring-projects/spring-xd/pull/1577  Deployment: single admin, 2 container deployment using +RabbitMQ+ as the transport.  Below is a partial stacktrace (please check log for full stacktrace).  Log is attached.  {noformat)  2015-05-15 10:50:15,843 1.2.0.SNAP ERROR xdbus.job:ec2Job3-1 step.AbstractStep - Encountered an error executing step readResourcesStep in job ec2Job3  org.springframework.dao.InvalidDataAccessApiUsageException: Cannot autogenerate id of type java.util.UUID for entity of type org.springframework.xd.tuple.DefaultTuple!          at org.springframework.data.mongodb.core.MongoTemplate.assertUpdateableIdIfNotSet(MongoTemplate.java:1153)          at org.springframework.data.mongodb.core.MongoTemplate.doSave(MongoTemplate.java:882)          at org.springframework.data.mongodb.core.MongoTemplate.save(MongoTemplate.java:837)          at org.springframework.batch.item.data.MongoItemWriter.doWrite(MongoItemWriter.java:128)          at org.springframework.batch.item.data.MongoItemWriter$1.beforeCommit(MongoItemWriter.java:156)          at org.springframework.transaction.support.TransactionSynchronizationUtils.triggerBeforeCommit(TransactionSynchronizationUtils.java:95)          at org.springframework.transaction.support.AbstractPlatformTransactionManager.triggerBeforeCommit(AbstractPlatformTransactionManager.java:928)          at org.springframework.transaction.support.AbstractPlatformTransactionManager.processCommit(AbstractPlatformTransactionManager.java:740)          at org.springframework.transaction.support.AbstractPlatformTransactionManager.commit(AbstractPlatformTransactionManager.java:726)          at sun.reflect.NativeMethodAccessorImpl.invoke0(Native Method)          at sun.reflect.NativeMethodAccessorImpl.invoke(NativeMethodAccessorImpl.java:57)          at sun.reflect.DelegatingMethodAccessorImpl.invoke(DelegatingMethodAccessorImpl.java:43)          at java.lang.reflect.Method.invoke(Method.java:606)  {noformat)",EST_BE,Medium,INT Sprint 1,6,6,5,6,7,6.0,0.33,0.06,6.0,6.17,6.42,6.77,6,1369,8
5,Rename controllers to have pluralized named (e.g. JobsController),"See implementation used for Steams and apply to jobs, taps, triggers.",EST_BE,Medium,INT Sprint 1,2,2,1,2,2,1.83,0.17,0.09,1.83,1.92,2.05,2.23,1,121,8
6,Reproducing errors of the current obs_decam package,"Learning the stack and development worlflow by reproducing errors in obs_decam as DM-3196.  Changes from the stack need to be incorporated into obs_decam package to keep the package up to date, hence the errors. As a learning process I reproduced the errors and used her fix (afw branch u/yusra/DM-3196) to move on.  ",EST_BE,Medium,INT Sprint 1,4,5,3,4,5,4.0,0.33,0.08,4.0,4.17,4.42,4.77,4,729,8
7,Week end 1/23/16,"Support for lsst-dev cluster, OpenStack, and accounts  for week ending January 23, 2016.",EST_BE,Medium,INT Sprint 1,4,5,3,4,4,3.83,0.17,0.04,3.83,3.92,4.05,4.23,3,441,8
8,Ruby: Problem formatting Ruby source code where block contains only comments,ctrl-shift-f can't format source code of the attached file.,EST_BE,Medium,INT Sprint 1,16,17,15,16,17,16.0,0.33,0.02,16.0,16.17,16.42,16.77,16,7569,8
9,Unify connectors and endpoints part 2,Need to finish implementation of https://docs.google.com/a/mulesoft.com/spreadsheet/ccc?key=0Ag_HMY-0TfqodGoxWHBfVFNkZ3kxS0FBSEtUQWswMkE&usp=drive_web,EST_BE,Medium,INT Sprint 1,16,17,15,16,17,16.0,0.33,0.02,16.0,16.17,16.42,16.77,16,7569,8
10,Android: CardView's cardMaxElevation should (marked as) be creation-only,As explain in the [Android Reference|https://developer.android.com/reference/android/support/v7/widget/CardView.html#attr_android.support.v7.cardview:cardElevation] and confirmed by tests I did the {{cardMaxElevation}} property is creation-only. Changing it later has no effect.,EST_BE,Medium,INT Sprint 1,4,4,3,4,4,3.83,0.17,0.04,3.83,3.92,4.05,4.23,3,441,8
11,Add Hadoop 2.4.x as an option,Hadoop 2.4.1 is now a stable release and we should add support for running against it,EST_BE,Medium,INT Sprint 1,6,6,5,6,6,5.83,0.17,0.03,5.83,5.92,6.05,6.23,5,961,8
12,save analysis's clientDependency twice,"1. create a column analysis with a column seletecd  2. add a pattern, the analysis is dirty status  3. run analysis  check the pattern and analysis item file, the saved clientDependency twice like follows    in analysis saved:      <clientDependency href=""../../TDQ_Libraries/Patterns/Regex/text/Empty_text_0.1.pattern#_iN9zkCYwEeatxa1yKMxw8w""/>      <clientDependency href=""../../TDQ_Libraries/Patterns/Regex/text/Empty_text_0.1.pattern#_pND3MiYxEeatxa1yKMxw8w""/>    in pattern rule saved:    <orgomg.cwm.objectmodel.core:Dependency xmi:id=""_iN9zkCYwEeatxa1yKMxw8w"" kind=""Usage"">      <client xsi:type=""dataquality.analysis:Analysis"" href=""../../../../TDQ_Data Profiling/Analyses/df_0.1.ana#_eHwooCYvEeatxa1yKMxw8w""/>    </orgomg.cwm.objectmodel.core:Dependency>    <orgomg.cwm.objectmodel.core:Dependency xmi:id=""_pND3MiYxEeatxa1yKMxw8w"" kind=""Usage"" supplier=""_vZ6_IGk6Ed2I1bT57-sHUw"">      <client xsi:type=""dataquality.analysis:Analysis"" href=""../../../../TDQ_Data Profiling/Analyses/df_0.1.ana#_eHwooCYvEeatxa1yKMxw8w""/>    </orgomg.cwm.objectmodel.core:Dependency>    for business rule analysis add a rule with get the same result",EST_BE,Medium,INT Sprint 1,2,2,1,2,3,2.0,0.33,0.16,2.0,2.17,2.42,2.77,2,289,8
13,sync tool writes log files into working directory,"The sync tools writes a duracloud-common.log file into the current working directory (possibly only an issue on non-windows platforms), writing to the relative file path ""./c:/work/programs/duracloud/logs/duracloud-common.log"", which causes some errors in the log files:  Caused by: org.duracloud.error.ContentStoreException: Error attempting to add content 'c:/work/programs/duracloud/logs/duracloud-common.log' in 'aapp-preservation' due to: Response code was 500, expected value was 201. Response body value: Error attempting to add content 'c:/work/programs/duracloud/logs/duracloud-common.log' in 'aapp-preservation' due to: Content c:/work/programs/duracloud/logs/duracloud-common.log was added to space aapp-preservation but the checksum, either provided or computed enroute, (c2e207b0a44d27e4337d16f93970f1e4) does not match the checksum computed by the storage provider (4f074bb6537ddb42a54f33b401bbd146). This content should be checked or retransmitted.   org.duracloud.client.ContentStoreImpl.addContent(ContentStoreImpl.java:394)   org.duracloud.chunk.writer.DuracloudContentWriter.addContent(DuracloudContentWriter.java:182) 	... 11 more Caused by: org.duracloud.error.ContentStoreException: Response code was 500, expected value was 201. Response body value: Error attempting to add content 'c:/work/programs/duracloud/logs/duracloud-common.log' in 'aapp-preservation' due to: Content c:/work/programs/duracloud/logs/duracloud-common.log was added to space aapp-preservation but the checksum, either provided or computed enroute, (c2e207b0a44d27e4337d16f93970f1e4) does not match the checksum computed by the storage provider (4f074bb6537ddb42a54f33b401bbd146). This content should be checked or retransmitted.   org.duracloud.client.ContentStoreImpl.checkResponse(ContentStoreImpl.java:512)   org.duracloud.client.ContentStoreImpl.addContent(ContentStoreImpl.java:380) 	... 12 more INFO           2010/06/24 16:43:01 [pool-2-thread-3] (SyncWorker.java:61) [retryOnFailure()] - Adding /Volumes/MLAMellonDigLib4/barcode101640/./c:/work/programs/duracloud/logs/duracloud-common.log back to the changed list, another attempt will be made to sync file.  ====  md-20013004:barcode101640 chris_beer$ java -jar ~/Downloads/synctool-0.3-driver.jar -d . -f 2000 -h wgbh.duracloud.org -p 443 -s aapp-preservation -t 4 -u admin -w changeme -b ..  Starting up the Sync Tool ..................... Startup Complete  --------------------------------------  Sync Tool Configuration -------------------------------------- Sync Directories:   /Volumes/MLAMellonDigLib4/barcode101640/. DuraStore Host: wgbh.duracloud.org DuraStore Port: 443 DuraStore Username: admin DuraCloud Space ID: aapp-preservation SyncTool Backup Directory: .. SyncTool Poll Frequency: 2000 SyncTool Threads: 4 SyncTool Max File Size: 1073741824 bytes SyncTool Syncing Deletes: false --------------------------------------   --------------------------------------  Sync Tool Help -------------------------------------- The following commands are available: x - Exits the Sync Tool c - Prints the Sync Tool configuration s - Prints the Sync Tool status l <Level> - Changes the log level to <Level> (may be any of DEBUG, INFO, WARN, ERROR) Location of logs: /Volumes/MLAMellonDigLib4/barcode101640/../logs --------------------------------------  s   --------------------------------------  Sync Tool Status -------------------------------------- Start Time: 2010-06-24 16:23:07.929 Sync Queue Size: 1 Syncs In Process: 2 Successful Syncs: 30 Failed Syncs: 3   /Volumes/MLAMellonDigLib4/barcode101640/./c:/work/programs/duracloud/logs/duracloud-common.log   /Volumes/MLAMellonDigLib4/barcode101640/./c:/work/programs/duracloud/logs/duracloud-common.log   /Volumes/MLAMellonDigLib4/barcode101640/./c:/work/programs/duracloud/logs/duracloud-common.log --------------------------------------  quit  md-20013004:barcode101640 chris_beer$  tail c\:/work/programs/duracloud/logs/duracloud-common.log  /logs/duracloud-common.log back to the changed list, another attempt will be made to sync file. Caused by: org.duracloud.error.ContentStoreException: Error attempting to add content 'c:/work/programs/duracloud/logs/duracloud-common.log' in 'aapp-preservation' due to: Response code was 500, expected value was 201. Response body value: Error attempting to add content 'c:/work/programs/duracloud/logs/duracloud-common.log' in 'aapp-preservation' due to: Content c:/work/programs/duracloud/logs/duracloud-common.log was added to space aapp-preservation but the checksum, either provided or computed enroute, (c2e207b0a44d27e4337d16f93970f1e4) does not match the checksum computed by the storage provider (4f074bb6537ddb42a54f33b401bbd146). This content should be checked or retransmitted.   org.duracloud.client.ContentStoreImpl.addContent(ContentStoreImpl.java:394)   org.duracloud.chunk.writer.DuracloudContentWriter.addContent(DuracloudContentWriter.java:182) 	... 11 more Caused by: org.duracloud.error.ContentStoreException: Response code was 500, expected value was 201. Response body value: Error attempting to add content 'c:/work/programs/duracloud/logs/duracloud-common.log' in 'aapp-preservation' due to: Content c:/work/programs/duracloud/logs/duracloud-common.log was added to space aapp-preservation but the checksum, either provided or computed enroute, (c2e207b0a44d27e4337d16f93970f1e4) does not match the checksum computed by the storage provider (4f074bb6537ddb42a54f33b401bbd146). This content should be checked or retransmitted.   org.duracloud.client.ContentStoreImpl.checkResponse(ContentStoreImpl.java:512)   org.duracloud.client.ContentStoreImpl.addContent(ContentStoreImpl.java:380) 	... 12 more INFO           2010/06/24 16:43:01 [pool-2-thread-3] (SyncWorker.java:61) [retryOnFailure()] - Adding /Volumes/MLAMellonDigLib4/barcode101640/./c:/work/programs/duracloud/logs/duracloud-common.log back to the changed list, another attempt will be made to sync file. ",EST_BE,Medium,INT Sprint 1,2,2,1,2,3,2.0,0.33,0.16,2.0,2.17,2.42,2.77,2,289,8
14,Allow slave reconfiguration on restart,"Make it so that either via a slave restart or a out of process ""reconfigure"" ping, the attributes and resources of a slave can be updated to be a superset of what they used to be.",EST_BE,Medium,INT Sprint 1,6,7,5,6,7,6.0,0.33,0.06,6.0,6.17,6.42,6.77,6,1369,8
15,Job Plugin - Notification Channel not correctly bound to MessageBus,,EST_BE,Medium,INT Sprint 1,8,9,7,8,8,7.83,0.17,0.02,7.83,7.92,8.05,8.23,7,1681,8
16,SimpleLog mode should have custom logic for locating configuration file,"OOTB, log4j2 looks for its configuration file using this algorithm:    * Scan all classpath looking for file log4j2-test.xml  * If not found, repeat looking for log4j2.xml    When Mule is running with its default logging infrastructure, this logic is overridden so that the search is not performed on all classpath but:    * First on the application classpath  * If not found on the domain classpath  * If not found, on the configuration folder    When running in simple log mode, all of Mule's custom logic is not applied and we fallback to log4j2 default implementation, which causes issues because we cannot guarantee that any other jar in the classpath includes such a file, causing the wrong file to be picked up.    When runnning in simple mode, log separation should be disabled but our custom search algorithm should still be applied.    Additionally, in both cases we should generate a log line informing the path in which we found the file.",EST_BE,Medium,INT Sprint 1,6,6,5,6,7,6.0,0.33,0.06,6.0,6.17,6.42,6.77,6,1369,8
17,Better error messages from the camera mapper when a template cannot be formatted,"The CameraMapper produces a very unhelpful traceback if it cannot format a template string with the provided data ID dict. For example:  {code}  Traceback (most recent call last):    File ""/Users/rowen/UW/LSST/lsstsw/stack/DarwinX86/pipe_tasks/12.0.rc1-3-gb785bf9/bin/processCcd.py"", line 25, in <module>      ProcessCcdTask.parseAndRun()    File ""/Users/rowen/UW/LSST/lsstsw/stack/DarwinX86/pipe_base/12.0.rc1-1-g832266b/python/lsst/pipe/base/cmdLineTask.py"", line 450, in parseAndRun      parsedCmd = argumentParser.parse_args(config=config, args=args, log=log, override=cls.applyOverrides)    File ""/Users/rowen/UW/LSST/lsstsw/stack/DarwinX86/pipe_base/12.0.rc1-1-g832266b/python/lsst/pipe/base/argumentParser.py"", line 479, in parse_args      self._processDataIds(namespace)    File ""/Users/rowen/UW/LSST/lsstsw/stack/DarwinX86/pipe_base/12.0.rc1-1-g832266b/python/lsst/pipe/base/argumentParser.py"", line 577, in _processDataIds      dataIdContainer.makeDataRefList(namespace)    File ""/Users/rowen/UW/LSST/lsstsw/stack/DarwinX86/pipe_base/12.0.rc1-1-g832266b/python/lsst/pipe/base/argumentParser.py"", line 126, in makeDataRefList      dataRef=dr)]    File ""/Users/rowen/UW/LSST/lsstsw/stack/DarwinX86/pipe_base/12.0.rc1-1-g832266b/python/lsst/pipe/base/argumentParser.py"", line 935, in dataExists      return butler.datasetExists(datasetType = datasetType, dataId = dataRef.dataId)    File ""/Users/rowen/UW/LSST/lsstsw/stack/DarwinX86/daf_persistence/12.0.rc1-1-gc553c11+4/python/lsst/daf/persistence/butler.py"", line 288, in datasetExists      locations = self.repository.map(datasetType, dataId)    File ""/Users/rowen/UW/LSST/lsstsw/stack/DarwinX86/daf_persistence/12.0.rc1-1-gc553c11+4/python/lsst/daf/persistence/repository.py"", line 392, in map      return self.doParents(Repository.doMap, *args, **kwargs)    File ""/Users/rowen/UW/LSST/lsstsw/stack/DarwinX86/daf_persistence/12.0.rc1-1-gc553c11+4/python/lsst/daf/persistence/repository.py"", line 325, in doParents      res = func(parent, *args, **kwargs)    File ""/Users/rowen/UW/LSST/lsstsw/stack/DarwinX86/daf_persistence/12.0.rc1-1-gc553c11+4/python/lsst/daf/persistence/repository.py"", line 405, in doMap      loc = self._mapper.map(*args, **kwargs)    File ""/Users/rowen/UW/LSST/lsstsw/stack/DarwinX86/daf_persistence/12.0.rc1-1-gc553c11+4/python/lsst/daf/persistence/mapper.py"", line 169, in map      return func(self.validate(dataId), write)    File ""/Users/rowen/UW/LSST/lsstsw/stack/DarwinX86/daf_butlerUtils/12.0.rc1+6/python/lsst/daf/butlerUtils/cameraMapper.py"", line 284, in mapClosure      return mapping.map(mapper, dataId, write)    File ""/Users/rowen/UW/LSST/lsstsw/stack/DarwinX86/daf_butlerUtils/12.0.rc1+6/python/lsst/daf/butlerUtils/mapping.py"", line 123, in map      path = mapper._mapActualToPath(self.template, actualId)    File ""/Users/rowen/UW/LSST/lsstsw/stack/DarwinX86/daf_butlerUtils/12.0.rc1+6/python/lsst/daf/butlerUtils/cameraMapper.py"", line 732, in _mapActualToPath      return template % self._transformId(actualId)  TypeError: %d format: a number is required, not NoneType  {code}    It is unclear what string was being formatted with what data, making the problem difficult to diagnose and correct.    I suggest changing line 732 of CameraMapper.py from:  {code}  return template % self._transformId(actualId)  {code}  to something like the following:  {code}  try:      transformedId = self._transformId(actualId)      return template % transformedId  except Exception as e:      raise RuntimeError(""Failed to format %r with data %r: %s"" % (template, transformedId, e))  {code}    Here are the last few lines of the same traceback after applying this change:  {code}      path = mapper._mapActualToPath(self.template, actualId)    File ""/Users/rowen/UW/LSST/lsstsw/stack/DarwinX86/daf_butlerUtils/12.0.rc1+6/python/lsst/daf/butlerUtils/cameraMapper.py"", line 735, in _mapActualToPath      raise RuntimeError(""Failed to format %r with data %r: %s"" % (template, transformedId, e))  RuntimeError: Failed to format '%(date)s/%(filter)s/decam%(visit)07d.fits.fz[%(hdu)d]' with data {'date': '2013-02-10', 'ccdnum': 10, 'hdu': None, 'visit': 176837, 'filter': 'z'}: %d format: a number is required, not NoneType  {code}    A bit wordy, but it is much easier to figure out what went wrong.    I have stumbled across this problem twice in the last few weeks, so I consider this change fairly important. The first time it was caused by a defective format string in a paf file. This time I'm not yet sure what is causing it, but at least I have something to go on.",EST_BE,Medium,INT Sprint 1,2,2,1,2,3,2.0,0.33,0.16,2.0,2.17,2.42,2.77,2,289,8
18,Test partitions by dynamic additions/deletions of modules,"As a user, I'd like to have the data partition strategy state preserved so that when I add/delete modules, they are able to dynamically adapt to the strategy.  This is already included as part of the GA release. This story is to account for the testing effort.",EST_BE,Medium,INT Sprint 1,2,3,1,2,3,2.0,0.33,0.16,2.0,2.17,2.42,2.77,2,289,8
19,"Error appears when empty Node.ACS >""Import Node.ACS binding "" to a mobile project",Test Steps:    1.File > New >Create a Titanium Project.  2.Project Explorer >Context menu > Node.ACS > Import Node.ACS binding.    Actual Result:  Error appears.Log attached.,EST_BE,Medium,INT Sprint 1,6,7,5,6,6,5.83,0.17,0.03,5.83,5.92,6.05,6.23,5,961,8
20,Train the model,Use a high computational system for training the model. Execute the model training script and monitor the performance of the model.,EST_AI,Medium,ET Sprint 3,24,23,24,25,26,25.0,0.33,0.01,25.0,25.17,25.42,25.77,25,17424,4
21,Increase memory locked amount in container,"In order to lock memory, the memory locking limit within the container for the qserv worker needs to be raised. My understanding is the container uses whatever is the host setting so the limit has to be set for the container user and whatever the user is inside the container. The particular limits is:    memorylocked 64 kbytes    notice that by default it's 64K. That needs to be raised to say 75% of the real machine size. I wouldn't make it unlimited as a memlock mistake may crash the whole machine. The limits are specified in ""/etc/security/limits.conf"". You will know that you are successul when you ssh into the container as the qserv worker user and the ""limit"" command tell you have can lock lots of memory.    We would also set the CAP_IPC_LOCK privilege but setting the soft/hard limit above should be good enough. So, let's start with that. ",EST_BE,Medium,INT Sprint 1,4,5,3,4,5,4.0,0.33,0.08,4.0,4.17,4.42,4.77,4,729,8
22,Update to Reactor 2.0 build snapshots,,EST_BE,Medium,INT Sprint 1,2,3,1,2,3,2.0,0.33,0.16,2.0,2.17,2.42,2.77,2,289,8
23,fix EventLog references in ctrl_orca,"There are a couple references to EventLog in ctrl_orca, which is an object that no longer exists.",EST_BE,Medium,INT Sprint 1,8,8,7,8,8,7.83,0.17,0.02,7.83,7.92,8.05,8.23,7,1681,8
24,Add CSS information for shared scans to integration test data.,Some tables int the integration tests need to be flagged as needing to be locked in memory and given a scan rating.,EST_BE,Medium,INT Sprint 1,2,2,1,2,3,2.0,0.33,0.16,2.0,2.17,2.42,2.77,2,289,8
25,Fix Qserv install doc and scripts for new newinstall.sh,Update qserv install docs per new info at https://pipelines.lsst.io/install/newinstall.html,EST_BE,Medium,INT Sprint 1,2,2,1,2,2,1.83,0.17,0.09,1.83,1.92,2.05,2.23,1,121,8
26,forcedPhotCoadd.py fails on HSC data,"When trying to run {{forcedPhotCoadd.py}} on HSC data, I see the following error:    {code}  $ forcedPhotCoadd.py /raid/swinbank/rerun/LSST/bootcamp --id filter='HSC-I' tract=0 patch=7,7  : Loading config overrride file '/nfs/home/swinbank/obs_subaru/config/forcedPhotCoadd.py'  Cannot import lsst.meas.extensions.photometryKron: disabling Kron measurements  Traceback (most recent call last):    File ""/home/lsstsw/stack/Linux64/meas_base/11.0+2/bin/forcedPhotCoadd.py"", line 24, in <module>      ForcedPhotCoaddTask.parseAndRun()    File ""/home/lsstsw/stack/Linux64/pipe_base/11.0+2/python/lsst/pipe/base/cmdLineTask.py"", line 433, in parseAndRun      parsedCmd = argumentParser.parse_args(config=config, args=args, log=log, override=cls.applyOverrides)    File ""/home/lsstsw/stack/Linux64/pipe_base/11.0+2/python/lsst/pipe/base/argumentParser.py"", line 360, in parse_args      self._applyInitialOverrides(namespace)    File ""/home/lsstsw/stack/Linux64/pipe_base/11.0+2/python/lsst/pipe/base/argumentParser.py"", line 475, in _applyInitialOverrides      namespace.config.load(filePath)    File ""/home/lsstsw/stack/Linux64/pex_config/11.0/python/lsst/pex/config/config.py"", line 529, in load      self.loadFromStream(stream=code, root=root)    File ""/home/lsstsw/stack/Linux64/pex_config/11.0/python/lsst/pex/config/config.py"", line 549, in loadFromStream      exec stream in {}, local    File ""/nfs/home/swinbank/obs_subaru/config/forcedPhotCoadd.py"", line 10, in <module>      config.deblend.load(os.path.join(os.environ[""OBS_SUBARU_DIR""], ""config"", ""deblend.py""))  AttributeError: 'ForcedPhotCoaddConfig' object has no attribute 'deblend'  {code}    This is with the stack version 11.0+3 and {{obs_subaru}} 5.0.0.1-676-g4ae362c.",EST_BE,Medium,INT Sprint 1,2,3,1,2,2,1.83,0.17,0.09,1.83,1.92,2.05,2.23,1,121,8
27,Interacting with XD on Yarn,1. How we talk to the XD instance(s) on Yarn 2. There is a rest interface which location can be exposed either via resource manager or appmaster 3. Technically appmaster could also expose interface which could eihter be proxy for xd rest or dedicated interface implementation(i.e. thrift or spring int),EST_BE,Medium,INT Sprint 1,2,2,1,2,3,2.0,0.33,0.16,2.0,2.17,2.42,2.77,2,289,8
28,Twitter Search results are not deserialized,"Data is returned, but not human readable i.e. ""org.springframework.social.twitter.api.Tweet@4b20a104"".  Needs to be readable in log and or file.  ",EST_BE,Medium,INT Sprint 1,6,7,5,6,6,5.83,0.17,0.03,5.83,5.92,6.05,6.23,5,961,8
