,Task_name,Task_description,Task_label,Task_priority,Sprint_number,Planned_estimate,Actual_estimate,Optimistic,Most_likely,Pessimistic,Weighted_average,Standard_deviation,Risk_factor,Standard_confidence,High_confidence,Higher_confidence,Highest_confidence,Final_estimate,Variance,Ai_estimate
354,Service & Policy export/import capabilities,"Improvements in Service Registry (SR)    The Service & Policy export/import capabilities of the Service Registry should be improved by   - Extending the Service Registry service to do the Export/Import for a given list of services/policies / or all serives/policies  - Extending the SR commands to do the Export/Import for a given list of services/policies / or all serives/policies  - In export, we need to provide an option if the attached policies to the wsdl should be exported or not.",EST_BE,Medium,INT Sprint 1,6,6,5,6,6,5.83,0.17,0.03,5.83,5.92,6.05,6.23,5,961,8
355,Add CLI command support an Android debug launch,h3. Debug Android  V1:  {code}  sdk-version/android/builder.py emulator [name] [android.sdk] [project-dir] [id] 6 HVGA  sdk-version/android/fastdev.py start [project-dir]  sdk-version/android/builder.py simulator [name] [android.sdk] [project-dir] [id] 6 HVGA /127.0.0.1:55040  {code}    V2:  {code}  titanium build --platform=android --emulator=[emulator.name] [project.dir]  titanium run --platform=android --emulator=[emulator.name] --debug [project.dir]  {code}    h3. Notes  # We need to make sure that FastDev is supported by the new CLI,EST_BE,Medium,INT Sprint 1,16,16,15,16,17,16.0,0.33,0.02,16.0,16.17,16.42,16.77,16,7569,8
356,"Create model architecture, Define loss function, optimizer, metrics, training and validation parameters","Model architecture - Define the model branches, layers, activation functions, and kernel initializers. Loss function - Speficy the loss for the model. Optimizer - Specify the optimizer to minimize the loss function. Metrics - Speficy the accuracy. Training & Validation parameters - Speficy other hyperparameters",EST_AI,Medium,ET Sprint 3,8,7,8,8,8,8.0,0.0,0.0,8.0,8.0,8.0,8.0,8,1600,8
357,Test Not Passing: IntersectionUnionPagingIT,,EST_BE,Medium,INT Sprint 1,4,5,3,4,5,4.0,0.33,0.08,4.0,4.17,4.42,4.77,4,729,8
358,Tune the model training parameters to improve accuracy - 4th variation,Experiment with model hyperparameters by observing the loss and accuracy graphs.,EST_AI,Medium,ET Sprint 4,12,0,12,12,13,12.17,0.17,0.01,12.17,12.26,12.39,12.57,12,4356,8
359,BE - Import Feature,,EST_BE,Medium,ET Sprint 4,32,24,32,33,33,32.83,0.17,0.01,32.83,32.92,33.05,33.23,32,27556,8
360,"In New Project wizard, New Mule Flow dialog doesn't replace whitespaces in the project name with underscores for the flow filename","Steps to reproduce:    1. Goto File -> New -> Other  2. Select Mule Project and click on ""Next >""  3. Type in the name field ""Ajax Spell Checker"" and click on ""Next >""    The New Mule Flow dialog has the File name field set to the project name but it doesn't replace the whitespaces with underscores.",EST_BE,Medium,INT Sprint 1,6,7,5,6,6,5.83,0.17,0.03,5.83,5.92,6.05,6.23,5,961,8
361,BPM ESB WS Connector: Authorization support,User must be able to configure connector to invoke authorized call.  For this on connector configuration should be added checkbox 'Authorization' and text field 'role name' (optional).  Implementation is simular to Authorization support for tESBConsumer. (TESB-8074),EST_BE,Medium,INT Sprint 1,2,2,1,2,2,1.83,0.17,0.09,1.83,1.92,2.05,2.23,1,121,8
362,Add support for async query results,"Modify Qserv to support async queries: send query results to the right place instead of to mysql proxy. In this story, we can simply use some reasonable default location and send the results there. Later on we will extend qserv to make it configurable.",EST_BE,Medium,INT Sprint 1,20,21,19,20,21,20.0,0.33,0.02,20.0,20.17,20.42,20.77,20,11449,8
363,As an Admin I want to create Writer accounts,,EST_BE,Medium,INT Sprint 1,8,9,7,8,8,7.83,0.17,0.02,7.83,7.92,8.05,8.23,7,1681,8
364,Move SDK check for cloud services back to 2.0,We moved the SDK check to 1.9 for demo purposes. Revert this back to 2.0 by Titanium Studio GA,EST_BE,Medium,INT Sprint 1,2,2,1,2,3,2.0,0.33,0.16,2.0,2.17,2.42,2.77,2,289,8
365,Task 4: Calculate encodings of inputs,,EST_AI,Medium,,2,2,2,3,4,3.0,0.33,0.11,3.0,3.17,3.42,3.77,3,484,8
366,"Bamboo executes all ""tries"", even if no new code is commited during the Quiet Period in Subversion","If no new commits are done during the Quite Period, Bamboo should not run one more try. However, even if no code is committed, Bamboo is always waiting the maximum number of tries:  {code}  2012-01-19 19:54:29,054 INFO [qtp1761506447-530] [AccessLogFilter] 127.0.0.1 GET http://nastro-azzuro:8085/updateAndBuild.action?buildKey=MSFAADMIN-MAX 88578kb  2012-01-19 19:54:29,180 INFO [AtlassianEvent::0-BAM::EVENTS:pool-1-thread-2] [SvnRepository] Collecting changes for 'PROJ-MAX' on path 'https://svn.atlassian.com/svn/private/atlassian/bambootest/trunk/successBuild' from version 169163 to 169163  2012-01-19 19:54:29,191 INFO [AtlassianEvent::0-BAM::EVENTS:pool-1-thread-2] [DefaultChangeDetectionManager] Found one change for Plan 'PROJ-MAX', waiting 30 seconds to see if there are any more... (4 retries remaining)  2012-01-19 19:54:59,218 INFO [AtlassianEvent::0-BAM::EVENTS:pool-1-thread-2] [SvnRepository] Collecting changes for 'PROJ-MAX' on path 'https://svn.atlassian.com/svn/private/atlassian/bambootest/trunk/successBuild' from version 169163 to 169163  2012-01-19 19:54:59,231 INFO [AtlassianEvent::0-BAM::EVENTS:pool-1-thread-2] [DefaultChangeDetectionManager] Found one change for Plan 'PROJ-MAX', waiting 30 seconds to see if there are any more... (3 retries remaining)  2012-01-19 19:55:29,259 INFO [AtlassianEvent::0-BAM::EVENTS:pool-1-thread-2] [SvnRepository] Collecting changes for 'PROJ-MAX' on path 'https://svn.atlassian.com/svn/private/atlassian/bambootest/trunk/successBuild' from version 169163 to 169163  2012-01-19 19:55:29,272 INFO [AtlassianEvent::0-BAM::EVENTS:pool-1-thread-2] [DefaultChangeDetectionManager] Found one change for Plan 'PROJ-MAX', waiting 30 seconds to see if there are any more... (2 retries remaining)  2012-01-19 19:55:59,299 INFO [AtlassianEvent::0-BAM::EVENTS:pool-1-thread-2] [SvnRepository] Collecting changes for 'PROJ-MAX' on path 'https://svn.atlassian.com/svn/private/atlassian/bambootest/trunk/successBuild' from version 169163 to 169163  2012-01-19 19:55:59,313 INFO [AtlassianEvent::0-BAM::EVENTS:pool-1-thread-2] [DefaultChangeDetectionManager] Found one change for Plan 'PROJ-MAX', waiting 30 seconds to see if there are any more... (one retry remaining)  2012-01-19 19:56:29,342 INFO [AtlassianEvent::0-BAM::EVENTS:pool-1-thread-2] [SvnRepository] Collecting changes for 'PROJ-MAX' on path 'https://svn.atlassian.com/svn/private/atlassian/bambootest/trunk/successBuild' from version 169163 to 169163  2012-01-19 19:56:29,352 INFO [AtlassianEvent::0-BAM::EVENTS:pool-1-thread-2] [ChangeDetectionListenerAction] Change detection found 5 changes  {code}",EST_BE,Medium,INT Sprint 1,4,5,3,4,5,4.0,0.33,0.08,4.0,4.17,4.42,4.77,4,729,8
367,Allow operators to assign net_cls major handles to mesos agents,The net_cls cgroup allows operators to assign a 16-bit major and 16-bit minor network handle to tasks associated with a specific net_cls cgroup. In mesos we need to give the operator the ability to fix the 16-bit major handle used in an agent. Fixing the parent handle on the agent allows operators to install default firewall rules using the parent handle to enforce a default policy (say DENY ALL) for all container traffic till the container is allocated a minor handle.     A simple way to achieve this requirement is to pass the major handle as a flag to the agent at startup.,EST_BE,Medium,INT Sprint 1,2,3,1,2,3,2.0,0.33,0.16,2.0,2.17,2.42,2.77,2,289,8
368,Experiment with re-parsing of streams when needed,"As a follow up to XD-2877, experiment with the removal of the list of modules from BaseDefinition and reparse as needed.    Branch is here: https://github.com/pperalta/spring-xd/tree/deploy-refactor-2",EST_BE,Medium,INT Sprint 1,16,17,15,16,16,15.83,0.17,0.01,15.83,15.92,16.05,16.23,15,6561,8
369,"New Mobile Project wizard: Selecting a Titanium SDK after deselecting deployment targets, reenables all deployment targets","ENVIRONMENT:  Mac OS X 10.8.4  Appcelerator Studio, build: 3.2.0.201309202153    REPRODUCTION:  1. From the menu bar, select New > Mobile Project.  2. In the wizard, select any template and click next.  3. Deselect a few deployment targets.  4. Change the Titanium SDK version.    EXPECTED RESULTS:  Deselected targets stay deselected.    ACTUAL RESULTS:  All targets are selected.",EST_BE,Medium,INT Sprint 1,6,7,5,6,7,6.0,0.33,0.06,6.0,6.17,6.42,6.77,6,1369,8
370,Reorganize TOC for manual,"Here is a strawman {noformat} Getting Started  (rather meaty compared to other top level sections, maybe have a section - running in SingleNode) * Running in Distributed Mode * Running on YARN *Application Configuration Message Bus Configuration Monitoring and Management  Technical Documentation    Architecture Distributed Runtime  (remove 'XD' prefix) Interactive Shell Batch Jobs Streams Modules Tuples Sources Processors Analytics Sinks Taps Type Conversion Deployment  (better name?) Best Practices (new section)  Admin UI DSL Reference REST API  Samples  {noformat}",EST_BE,Medium,INT Sprint 1,4,4,3,4,4,3.83,0.17,0.04,3.83,3.92,4.05,4.23,3,441,8
371,Bulk Update fails using a file as a source when the file was generated in Windows due to \r at the end of the line,"Bulk Update fails using a file as a source when the file was generated in Windows due to \r at the end of the line.  The following works when line endings are Unix style but it does not work when line endings are Windows style:    INSERT INTO contact (id, first_name, last_name, email, last_modified) VALUES (1,'Juancito','Perez','juanperez@gmail.com','2014-02-18 12:13:35');  INSERT INTO contact (id, first_name, last_name, email, last_modified) VALUES (2,'pedro','perez','pedroperez@gmail.com','2014-02-11 14:53:21');  ",EST_BE,Medium,INT Sprint 1,4,4,3,4,5,4.0,0.33,0.08,4.0,4.17,4.42,4.77,4,729,8
372,BlackBerry: Implement UI.TabGroup elements needed for KitchenSink,,EST_BE,Medium,INT Sprint 1,24,24,23,24,25,24.0,0.33,0.01,24.0,24.17,24.42,24.77,24,16129,8
373,Watermark - unable to access default user Object Store instance,"*Steps*    with this flow     {code}          <poll frequency=""1000"" doc:name=""Poll"">  	        <watermark variable=""watermarkKey"" default-expression=""initialized"" update-expression=""#[payload]"" />          </poll>  {code}    watermark does not access the default user Object Store ",EST_BE,Medium,INT Sprint 1,2,3,1,2,3,2.0,0.33,0.16,2.0,2.17,2.42,2.77,2,289,8
374,Studio: Checking for new Titanium Updates results in internal error,An internal error occurred during checking for new titanium Updates.    h5.To reproduce    Titanium Studio>Help>Check for Titanium Updates    h5. Actual result    An error message,EST_BE,Medium,INT Sprint 1,6,6,5,6,6,5.83,0.17,0.03,5.83,5.92,6.05,6.23,5,961,8
375,iOS: CommonJS require: undeclared variable referenced from module fails to generate error,"Undeclared variables referenced from a module fail to generate an error. Android does generate the error. Screenshot attached.    The undeclared variable can then be used in further logic, such as adding it to a window. Screenshot attached.    If an undeclared variable is used in the module itself, there is an error.  If an undeclared variable is returned from an exports function-call, there is an error.  If an undeclared variable is defined as a return value in an exports function, but the function is never called, there is no error.  If an undeclared variable is returned from an exports function-call and assigned to a new variable outside the module, there is no error, and the variable can continue to be used.    Steps to Reproduce:    1. Run Code (also attached):    {code:title=app.js}  var undeclaredVar = require('Module').getUndeclaredVar();    Ti.UI.createWindow().add(undeclaredVar);  {code}    {code:title=Module.js}  exports.getUndeclaredVar = function()  {  	return undeclaredVar;  };  {code}    Expected Result:    Runtime error indicating undeclared variable.    Actual Result:    No runtime error.",EST_BE,Medium,INT Sprint 1,4,5,3,4,5,4.0,0.33,0.08,4.0,4.17,4.42,4.77,4,729,8
376,"Use ""TestFlight"" logo on relevant dialogs and wizards",Add the TestFlight logo to at least the following screens:    # Register existing  # Publish wizard,EST_BE,Medium,INT Sprint 1,16,16,15,16,17,16.0,0.33,0.02,16.0,16.17,16.42,16.77,16,7569,8
377,Android: TextArea maxLength not working in Android,"According to the docs, TextArea supports maxLength property from SDK 3.0. However, maxLength does not work in Android.     In TiUIText.java, the code that reads the maxLength is:    if (d.containsKey(TiC.PROPERTY_MAX_LENGTH) && field) {      maxLength = TiConvert.toInt(d, TiC.PROPERTY_MAX_LENGTH);  }    TextArea has ""field"" boolean set to false, so maxLength is always ignored.    Steps to reproduce. Create simple App.js:    {code}  var win = Ti.UI.createWindow({    backgroundColor: 'white'  });  var textArea = Ti.UI.createTextArea({    borderWidth: 2,    borderColor: '#bbb',    borderRadius: 5,    color: '#888',    textAlign: 'left',      maxLength: 10,    top: 60,    width: 300,    height : 150  });  win.add(textArea);  win.open();  {code}    Launch app and start writing in the text area. You can enter more than 10 chars, despite maxLength is set to 10. Tested with SDK 3.0.0.GA in Android 2.3.3 and Android 4.1",EST_BE,Medium,INT Sprint 1,6,6,5,6,7,6.0,0.33,0.06,6.0,6.17,6.42,6.77,6,1369,8
378,Windows: Module generator is using wrong name format for getters,"The module generator is not generating the correct name pattern for property getters: i.e. ""color"" (incorrect) vs ""get_color"" (correct). Same for the equivalent js_* bridge methods.",EST_BE,Medium,INT Sprint 1,2,3,1,2,3,2.0,0.33,0.16,2.0,2.17,2.42,2.77,2,289,8
379,"As a GH developer, I would like for the custom fields that GH creates to appear as ""managed"" in JIRA's administration interface","FINAL BEHAVIOR:  1. For fields with options (epic status): If everything is 1:1 like the original configuration, then lock the field, otherwise don't lock the field  1a. Unless there is all projects/appropriate issues field scheme with ZERO options in there. In that case we will just add the options.  1b. Unless there are no schemes, in which case we introduce our own.  2. For fields without option fix up the contexts then lock the field  3. do NOT fix up field names/descriptions for any of the fields  3a. But fix the searcher.  4. for the Rank field, change managed level to ""admin"" (field creation) plus a message that the field should normally not be created as GH creates the field  5. The default rank field should be fixed up in context and then locked.    In JIRA 5.2 there is a new API around Managed Configuration Items. This allows a plugin to specify that instances of custom fields, and custom field types, are ""managed"" by the plugin and should not be modified/created by administrators.  Fields to be restricted (no edit, no create): All Issue Types/Global Context: - Epic Link(show) - Sprint(show) - Rank(show)  Epics only/Global Context - Epic Status(show) - Epic Name(show/require/renderer - default text) - Epic Color(show)  We must also ensure that existing fields are in the correct configuration before locking them down.  (!) Development Notes (!)  Q: Is fixVersions one of these since we rely on it for release planning? A: (/) No - it is a system field provided by JIRA and therefore should be locked by definition.  Q: Rank field? A: (/) Also fix/lock the default rank field",EST_BE,Medium,INT Sprint 1,6,7,5,6,7,6.0,0.33,0.06,6.0,6.17,6.42,6.77,6,1369,8
380,Documented Example: 'Rent-a-Car' Service for Talend ESB - OSGi,Rebuild the Rent-a-Car Service as CXF JAX-WS Consumer & Provider similar to the once we provided in the Swordfish Tutorial for Helios. Also the Swing Client should be migrated and work within this example with the new Talend ESB Service consumers and providers and within our OSGi Container (Equinox + Karaf).    It is expected that the consumer can switch between a static (local config/policies) and a dynamic (SR policies) even though initial it only needs to work with local configuration/policies.,EST_BE,Medium,INT Sprint 1,6,7,5,6,7,6.0,0.33,0.06,6.0,6.17,6.42,6.77,6,1369,8
381,Onboarding Humberto,Efforts in helping new employee Humberto come up to speed in his role as lead on perfsonar deployments,EST_BE,Medium,INT Sprint 1,2,2,1,2,2,1.83,0.17,0.09,1.83,1.92,2.05,2.23,1,121,8
382,Console: no colors on new lines in debug output,"Console: no colors on new lines in debug output (see screenshot).    Steps to Reproduce:    1. Run code:    {code}  Ti.API.trace('line0\nline1\nline2\nline3');  Ti.API.trace(['Ti.API TRACE', 'ARG1', 'ARG2']);     Ti.API.debug('line0\nline1\nline2\nline3');  Ti.API.debug(['Ti.API DEBUG', 'ARG1', 'ARG2']);     Ti.API.info('line0\nline1\nline2\nline3');  Ti.API.info(['Ti.API INFO', 'ARG1', 'ARG2']);     Ti.API.warn('line0\nline1\nline2\nline3');  Ti.API.warn(['Ti.API WARN', 'ARG1', 'ARG2']);     Ti.API.error('line0\nline1\nline2\nline3');  Ti.API.error(['Ti.API ERROR', 'ARG1', 'ARG2']);  {code}    Actual Result:    No log-level colors on new lines.    Expected Result:    Log-level colors on new lines should match.",EST_BE,Medium,INT Sprint 1,16,17,15,16,17,16.0,0.33,0.02,16.0,16.17,16.42,16.77,16,7569,8
383,Pydev local import quick fix does not condense imports from same file,"{html}<div><p>To reproduce:</p>  <pre>  <code class=""python"">class Eggs(object):    def spam():      from string import Template      return Template('') + digits # Press CTRL+1 on this line. Hold down CTRL while selecting from string for 'string.digits'</code>  </pre>  <p>result:<br></p>  <pre>  <code class=""python"">class Eggs(object):    def spam():      from string import Template    from string import digits      return Template('') + digits</code>  </pre>  <p>expected:<br></p>  <pre>  <code class=""python"">class Eggs(object):    def spam():      from string import Template, digits      return Template('') + digits</code>  </pre></div>{html}",EST_BE,Medium,INT Sprint 1,2,3,1,2,3,2.0,0.33,0.16,2.0,2.17,2.42,2.77,2,289,8
384,Exported OSGI bundle cann't start when contains cActiveMQ,"If a route contains cActiveMQ, it will be not started in ESB Runtime when exported as an OSGI bundle.     The main reason is the bundle lacks of necessary Import Packages and Required Bundles.",EST_BE,Medium,INT Sprint 1,2,2,1,2,3,2.0,0.33,0.16,2.0,2.17,2.42,2.77,2,289,8
385,Week end 10/17/15,"Support for lsst-dev cluster, OpenStack, and accounts  for week ending October 17, 2015.",EST_BE,Medium,INT Sprint 1,6,7,5,6,7,6.0,0.33,0.06,6.0,6.17,6.42,6.77,6,1369,8
386,Support image and drawing layer subgrouping,,EST_BE,Medium,INT Sprint 1,16,17,15,16,17,16.0,0.33,0.02,16.0,16.17,16.42,16.77,16,7569,8
387,"Android:  When Multiple Views in horizontal layout, ""SIZE"" constrains to the full container size, not the remaining available width","If you create a View with a horizontal layout and a fixed width, and two children, one of fixed width, and one of ""SIZE"" width, the second one will expand to, what appears to be, the full size of the container, even though this makes it run out of the containing view (and get cut off).  This works as expected in iOS.      Also, if you set the view to FILL, it doesn't get cut off in that case either.    Here's an example of code that demonstrates this issue.    Note, depending on screen size, part of the ""Alphabet"" label is getting cut off.  The amount that gets cut off seems to be dependent on the size of the view I've ID'ed as ""Control"".    <Alloy>    <Window class=""container"" layout=""vertical"" >     <View id=""Title"" layout=""vertical"" height=""Ti.UI.SIZE""       width=""90%"" top=""5"" bottom=""5""><Label height=""Ti.UI.SIZE"">Test 123</Label></View>         <View height=""Ti.UI.SIZE"" width=""87%"" layout=""vertical"">  		<View layout=""horizontal""   			height=""Ti.UI.SIZE"" width=""Ti.UI.FILL""  			backgroundColor=""#400098C3""  			horizontalWrap=""false""  			top=""2"" bottom=""2""  		>  			<View id=""Control"" height=""20"" width=""20""  				top=""5"" bottom=""5""  				left=""2"" right=""2""  			/>  			<Label id=""Alphabet"" height=""Ti.UI.SIZE"" width=""Ti.UI.SIZE"">abcdefghijklmnopqrstuvwxyzabcdefghijklmnopqrstuvwxyz</Label>  		</View>     </View>    </Window>   </Alloy>",EST_BE,Medium,INT Sprint 1,16,16,15,16,17,16.0,0.33,0.02,16.0,16.17,16.42,16.77,16,7569,8
388,"Create modules for data to be displayed in dashboard for multiple cases (i.e. current session, daily session, weekly session, monthly session, yearly session, etc...) - 1",Create classse and modules in python. Using this we can dispaly session data stored in DB as per the inputs from user.,EST_AI,High,DROW Sprint 5,32,40,32,32,32,32.0,0.0,0.0,32.0,32.0,32.0,32.0,32,25600,8
